<?xml version="1.0" encoding="UTF-8"?>
<?xml-stylesheet type="text/xsl" ?>
<casaxml xmlns="http://casa.nrao.edu/schema/psetTypes.html"
xmlns:xsi="http://www.w3.org/2001/XMLSchema-instance"
xsi:schemaLocation="http://casa.nrao.edu/schema/casa.xsd
file:///opt/casa/code/xmlcasa/xml/casa.xsd">


<!-- This is the param set for sdimprocess -->

<task type="function" name="sdimprocess" startup="false" category="single dish">

  <shortdescription>SD task: task for single-dish image processing</shortdescription>

  <description>SD task for image processing including "Pressed-out" method and "Basket-Weaving"

        Task Version 2009-10-01 TN
</description>

  <input>
    <param type="any" name="sdimages"  mustexist="true">
            <description>name of input SD image (FITS or CASA image)</description>
            <any type="variant" limittype="string stringArray"/>
            <value type="stringArray">''</value>
    </param>

    <param type="string" name="mode">
            <description>processing mode ("press" or "basket")</description>
            <allowed kind="enum">
                <value>basket</value>
                <value>press</value>
            </allowed>
    </param>

    <param type="int" name="numpoly" subparam="true">
            <description>order of polynomial fit</description>
            <value>2</value>
    </param>

    <param type="double" name="beamsize" subparam="true">
            <description>beam size</description>
            <any type="variant" limittype="double string"/>
            <value type="double">0.0</value>
    </param>
    
    <param type="any" name="smoothsize" subparam="true">
            <description>size of smoothing beam</description>
            <any type="variant" limittype="double string"/>
            <value type="double">2.0</value> 
    </param>

    <param type="any" name="direction" subparam="true">
            <description>scan direction in unit of degree</description>
            <any type="variant" limittype="double doubleArray"/>
            <value type="doubleArray"></value>
    </param>

    <param type="any" name="masklist" subparam="true">
            <description>mask width (on percentage)</description>
            <any type="variant" limittype="double doubleArray"/>
            <value type="double">1.0</value>
    </param>

    <param type="double" name="tmax">
            <description>maximum value used for process</description>
            <value>0.0</value>
    </param>

    <param type="double" name="tmin">
            <description>minimum value used for process</description>
            <value>0.0</value>
    </param>

    <param type="string" name="imagename">
	    <description>output CASA image name</description>
	    <value></value>
    </param>

    <param type="bool" name="overwrite">
            <description>overwrite option for imagename</description>
            <value>False</value>
    </param>

    <constraints>
            <when param="mode">
                <equals value="basket">
                    <default param="direction"><value type="doubleArray"></value></default>
                    <default param="masklist"><value type="double">1.0</value></default>
                </equals>
                <equals value="press">
                    <default param="numpoly"><value type="int">2</value></default>
                    <default param="beamsize"><value type="double">0.0</value></default>
                    <default param="smoothsize"><value type="double">2.0</value></default>
                    <default param="direction"><value type="double">0.0</value></default>
                </equals>
            </when>
   </constraints>

  </input>

  <returns type="void"/>

  <example>
  Keyword arguments:
        sdimages -- name of input SD (FITS or CASA) image
        mode -- processing mode
                default: 'basket'
                options: 'basket', 'press'
               direction -- scan direction in unit of degree
                   default: []
                   example: [0.0,90.0]
               masklist -- mask width for Basket-Weaving on percentage
                   default: 1.0 (1.0% of map size)
               numpoly -- order of polynomial fit in Presssed-out
                   default: 2
               beamsize -- beam size 
                   default: 0.0
                   example: 10.0 (interpreted as '10arcsec'), '1arcmin'
               smoothsize -- smoothing beam in Pressed-out
                   default: 2.0 (interpreted as 2.0 * beamsize)
                   example: '1arcmin' (set smoothsize directly)
        tmax -- maximum value used for process
                default: 0.0 (no threshold in maximum)
                example: 10.0 (mask data larger value than 10.0)
        tmin -- minimum value used for process
                default: 0.0 (no threshold in minimum)
                example: -10.0 (mask data smaller value than -10.0)
        imagename -- output CASA image name
                default: '' (use default name)
                example: 'output.im'
        overwrite -- overwrite option for imagename
                default: False (not overwrite)
                options: True, False
                example: if True, existing file will be overwritten


        DESCRIPTION:

        Task sdimprocess is used to remove a scanning noise that appears 
        as a striped noise pattern along the scan direction in a raster 
        scan data. 

        By default, the scanning noise is removed by using the 
        'Basket-Weaving' method (Emerson &amp; Grave 1988) that requires 
        multiple images that observed exactly the same area with different 
        scanning direction. If only one image is available, the 'Pressed-out' 
        method (Sofue &amp; Reich 1979) can be used to remove the scanning 
        effect.

        For 'Basket-Weaving', scanning directions must have at least two 
        different values. Normally, the scanning direction should be 
        specified for each input image. Otherwise, specified scanning 
        directions will be used iteratively. The masklist is a width of 
        masking region in the Fourier plane. It is specified as a fraction 
        (percentage) of the image size. 

        For 'Pressed-out', the scanning direction must be unique. There are 
        two ways to specify a size of smoothing beam used for process. One 
        is to specify smoothing size directly. To do this, smoothsize should 
        be specified as string that consists of a numerical value and an unit 
        (e.g. '10.0arcsec'). A value of beamsize will be ignored in this case. 
        Another way to specify smoothing size is to set an observed beam size 
        and indicate smoothing size as a scale factor of the observed beam 
        size. In this case, the beamsize is interpreted as the observed beam 
        size, and the smoothsize is the scale factor. If the beamsize is 
        provided as float value, its unit is assumed to 'arcsec'. It is also 
        possible to set the beamsize as string consisting of the numerical 
        value and the unit. The smoothsize must be float value.

        The sdimages only allows an image data (CASA or FITS), and not does
        not work with MS or Scantable. The direction is an angle with respect 
        to the horizontal direction, and its unit is degree. Any value may be 
        interpreted properly, but the value ranging from 0.0 to 180.0 will be 
        secure. The tmax and the tmin is used to specify a threshold that 
        defines a range of spectral values used for processing. The data point 
        that has the value larger than tmax or smaller than tmin will be 
        excluded from the processing. The default (0.0) is no threshold. 
        The imagename specifies an output CASA image name. If the imagename 
        is empty, the default name ('sdimprocess.out.im') will be used. 
  </example>

</task>

</casaxml>
